{
  "$schema": "https://json-schema.org/draft/2020-12/schema",
  "$id": "vfharness-checkpoint",
  "title": "VF harness task checkpoint",
  "type": "object",
  "required": ["task_id", "status", "pack", "completed_steps", "next_step", "artifacts", "unresolved", "last_updated"],
  "additionalProperties": false,
  "properties": {
    "task_id": { "type": "string", "minLength": 1 },
    "status": { "enum": ["running", "blocked", "escalated", "done"] },
    "component_state": {
      "type": "string",
      "enum": ["Idle", "Processing", "Degraded", "Syncing", "Blocked"],
      "description": "Operational SoC state (ADR-THREE-LAYERS). Distinct from task status. Degraded = failover active."
    },
    "pack": { "type": "string", "minLength": 1 },
    "goal": {
      "type": "string",
      "description": "Optional session completion condition (DeerFlow /goal pattern). Sale ₪ is never a goal — use decision_gate."
    },
    "crew": {
      "type": "string",
      "description": "Existing vfe2b crew when this checkpoint backs a משמרת (morning-brief, inquiry, content, research, books-data)."
    },
    "planned_steps": {
      "type": "array",
      "description": "Plan preview before execution — coordinator pattern from Open Multi-Agent, without a second runtime.",
      "items": { "type": "string" },
      "maxItems": 8
    },
    "completed_steps": {
      "type": "array",
      "items": { "type": "string" }
    },
    "next_step": { "type": "string" },
    "artifacts": {
      "type": "array",
      "items": { "type": "string" }
    },
    "unresolved": {
      "type": "array",
      "items": { "type": "string" }
    },
    "outcome": {
      "type": ["string", "null"],
      "enum": ["worker_done", "escalation", "decision_gate", null],
      "description": "Run card מצב when the משמרת closes or pauses on a durable gate."
    },
    "pulse": {
      "type": "string",
      "enum": ["working", "blocked", "idle"],
      "description": "Run card דופק — herdr pattern on the same card."
    },
    "verification": {
      "type": "string",
      "description": "Run card אימות — sensor name, named field read, tool receipt, or חסר."
    },
    "gate": {
      "type": ["object", "null"],
      "description": "Durable pause until a human or lead seat clears the gate. Checkpoint stays blocked; do not emit worker_done.",
      "additionalProperties": false,
      "properties": {
        "kind": { "enum": ["decision_gate", "escalation", "approval"] },
        "waiting_for": { "type": "string", "minLength": 1 },
        "reason": { "type": "string" }
      },
      "required": ["kind", "waiting_for"]
    },
    "escalation": { "type": ["string", "null"] },
    "last_updated": { "type": "string", "minLength": 8 },
    "execution_state": {
      "type": "object",
      "description": "SKILLSTATE Σ domain slots — sufficient statistic for the next step without chat replay. Prefer core checkpoint keys first; use this for domain-specific fields. No invented ₪ or Insights.",
      "additionalProperties": true
    },
    "latest_observation": {
      "type": "string",
      "description": "SKILLSTATE O_t — short summary of the last environment/tool/sensor observation only (not full history)."
    },
    "events": {
      "type": "array",
      "description": "Huginn-style event log flowing between scenario steps (optional)",
      "items": {
        "type": "object",
        "required": ["name", "producedAt"],
        "additionalProperties": false,
        "properties": {
          "name": {
            "type": "string",
            "minLength": 1,
            "description": "Event type e.g. inquiry.received, mail.sent"
          },
          "producedAt": {
            "type": "string",
            "minLength": 8,
            "description": "ISO-8601 or YYYY-MM-DD"
          },
          "payload": {
            "type": "object",
            "description": "Step-specific data; no invented ₪ or Insights"
          },
          "sourceAgent": {
            "type": "string",
            "description": "Pack or scenario step that emitted the event"
          }
        }
      }
    }
  }
}
