{
  "task_id": "superpowers-v63-harness-2026-09-13",
  "status": "blocked",
  "component_state": "Blocked",
  "pack": "vfharness",
  "goal": "Absorb selected obra/superpowers v6.3 execution-discipline patterns into the existing vfharness without a second runtime, with reviewable evidence and no weakened authority gates.",
  "planned_steps": [
    "safe-ruling-rung",
    "plan-preflight",
    "test-first-discipline",
    "fresh-review-and-parallel-dispatch",
    "provenance-and-verification",
    "pr"
  ],
  "completed_steps": [
    "review-existing-harness",
    "create-branch",
    "write-plan-and-evidence-preflight",
    "safe-ruling-rung",
    "plan-preflight",
    "test-first-discipline",
    "fresh-review-and-parallel-dispatch",
    "provenance-changelog-and-living-readme",
    "focused-behavioral-verification",
    "existing-caller-compatibility-smoke",
    "fresh-context-integrated-diff-review",
    "repair-review-findings",
    "github-actions-full-suite-58-of-58"
  ],
  "next_step": "Obtain a second independent high-risk reviewer for PR #203. If that review has no unresolved blocker/important finding and the final head CI remains green, merge under the normal repository gate.",
  "artifacts": [
    "https://github.com/nocturney/velvetos-core/pull/203",
    "packages/vfharness/state/superpowers-v63-harness-2026-09-13/task_plan.md",
    "packages/vfharness/state/superpowers-v63-harness-2026-09-13/preflight.md",
    "packages/vfresearch/sources/2026-09-13-superpowers-v63.md",
    "scripts/check-vfharness-execution-discipline.py",
    "https://github.com/nocturney/velvetos-core/actions/runs/34761452108"
  ],
  "unresolved": [
    "Second independent high-risk reviewer is unavailable in the current execution environment.",
    "PR #203 is intentionally not merged until the high-risk review gate is satisfied."
  ],
  "outcome": "decision_gate",
  "pulse": "blocked",
  "verification": "Final reviewed head 5770a365 GitHub Actions run #523 / 34761452108 PASS (supersedes pre-final run #521 / 34761289350): Living README, README System Pulse, full VelvetOS sensors 58/58, commission isolation. Focused Windows verification also proved safe-ruling behavior, structural wiring, existing vfsales caller compatibility, and self-test state isolation.",
  "gate": {
    "kind": "approval",
    "waiting_for": "second independent high-risk reviewer",
    "reason": "vfharness is the outer execution harness; current critique-review policy requires independent high-risk convergence before merge/completion claim. No second reviewer harness/bot is available in this environment."
  },
  "escalation": null,
  "last_updated": "2026-09-13",
  "latest_observation": "Final reviewed implementation head before this checkpoint update passed GitHub Actions run #521 with all 58 sensors and commission isolation green. Fresh review found and repaired CHANGELOG corruption/orphan text, self-test state pollution, Living README/System Pulse drift, and this checkpoint schema mismatch."
}
