{
  "task_id": "cp085-receipt-dir-mask-2026-10-18",
  "status": "done",
  "component_state": "Idle",
  "pack": "vfharness",
  "goal": "Reject group-readable CP085 receipt directories 0o750 and 0o740, accept 0o700, and catch a copied mask mutation from 0o077 to 0o007.",
  "completed_steps": [
    "CLAIM on #612 comment 6252564483",
    "POSIX tests refuse 0o750 and 0o740 with RECEIPT_DIR_MUST_BE_PRIVATE",
    "POSIX test accepts 0o700",
    "Copied mutation st_mode & 0o077 to 0o007 is caught"
  ],
  "next_step": "Independent QA. security_admission stays RED.",
  "artifacts": [
    "scripts/test_vf_office_v2_604_cp085_public_git_readback.py",
    "scripts/check-office-v2-contracts.py"
  ],
  "unresolved": [
    "security_admission stays RED",
    "write_private_receipt is unchanged"
  ],
  "last_updated": "2026-10-18",
  "execution_state": {
    "claim": "https://github.com/nocturney/velvetos-core/issues/612#issuecomment-6252564483",
    "security_admission": "RED",
    "posix_mode_check": "st_mode & 0o077",
    "mutation": "st_mode & 0o077 to st_mode & 0o007",
    "windows_execution": false
  },
  "latest_observation": "On POSIX, receipt directories 0o750 and 0o740 raise RECEIPT_DIR_MUST_BE_PRIVATE and 0o700 is accepted. A copied 0o007 mask accepts the group-readable directories. Non-POSIX prints SKIP_NON_POSIX."
}
