{
  "task_id": "fragment-line-and-rename-2026-10-18",
  "status": "done",
  "component_state": "Idle",
  "pack": "vfharness",
  "goal": "Compile-step fold is whole-line, a rename is a deletion, and an in-place fragment overwrite is not coverage.",
  "completed_steps": [
    "CLAIM on #612 comment 6255827303"
  ],
  "next_step": "Independent QA. security_admission stays RED.",
  "artifacts": [
    "scripts/changelog_contract.py",
    "changelog.d/fragment-line-and-rename.md"
  ],
  "unresolved": [
    "security_admission stays RED"
  ],
  "last_updated": "2026-10-18",
  "execution_state": {
    "claim": "https://github.com/nocturney/velvetos-core/issues/612#issuecomment-6255827303",
    "security_admission": "RED"
  },
  "latest_observation": "Whole-line fold, rename-as-delete, and status M overwrite are each covered by a selftest that fails when that check is removed."
}
