{
  "task_id": "fragment-delete-not-coverage-2026-10-18",
  "status": "done",
  "component_state": "Idle",
  "pack": "vfharness",
  "goal": "A deleted or emptied changelog fragment must not cover a capability change, and deleting an existing fragment is only the compile step.",
  "completed_steps": [
    "CLAIM on #612 comment 6255707676"
  ],
  "next_step": "Independent QA. security_admission stays RED.",
  "artifacts": [
    "scripts/changelog_contract.py",
    "changelog.d/fragment-delete-not-coverage.md"
  ],
  "unresolved": [
    "security_admission stays RED"
  ],
  "last_updated": "2026-10-18",
  "execution_state": {
    "claim": "https://github.com/nocturney/velvetos-core/issues/612#issuecomment-6255707676",
    "security_admission": "RED"
  },
  "latest_observation": "Status D and an emptied fragment fail the gate. A compile diff that folds the deleted bullet into CHANGELOG.md passes."
}
