{
  "task_id": "evening-catalog-2026-09-08",
  "status": "done",
  "pack": "vfharness",
  "goal": "Same-day GitHub catalog refresh (catalogRefreshedAt 2026-09-08) even when Origin will not clone.",
  "completed_steps": [
    "Read origin/main + CHANGELOG Unreleased + packages/manifest.json",
    "origin auth status: not logged in; skip vendor",
    "Confirm 31 pack dirs match catalog including vfmedia",
    "Prepend evening-catalog note; keep catalogRefreshedAt 2026-09-08",
    "Add CHANGELOG Unreleased evening-catalog line; leave #138 open"
  ],
  "next_step": "Push branch + PR; push main if catalog-only and sensors pass.",
  "artifacts": [
    "packages/manifest.json",
    "CHANGELOG.md"
  ],
  "unresolved": [
    "Origin not vendored (CLI not logged in)",
    "Six packs remain origin-unreachable until origin auth login",
    "PR #138 live commissioning left open"
  ],
  "last_updated": "2026-09-08",
  "pulse": "working",
  "verification": "scripts/check-all.py",
  "outcome": "worker_done"
}
