{
  "task_id": "oma-pattern-embed-2026-08-31",
  "status": "done",
  "pack": "vfharness",
  "crew": "run",
  "planned_steps": [
    "Extend checkpoint.schema.json with planned_steps, gate, outcome, pulse, verification",
    "Add checkpoint.example-run.json and run-receipt.md template",
    "Add playbooks/oma-patterns.md and wire run.md + ORCHESTRATORS.md",
    "Extend check-vfharness.py for new artifacts",
    "Run python3 scripts/check-all.py"
  ],
  "completed_steps": [
    "Extended checkpoint schema and example-run",
    "Added run-receipt.md and oma-patterns.md playbook",
    "Wired run.md, LOOP.md, layers.json, orchestrators.json, CHANGELOG",
    "All 16 sensors green"
  ],
  "next_step": "",
  "artifacts": [
    "packages/vfharness/templates/checkpoint.schema.json",
    "packages/vfharness/templates/checkpoint.example-run.json",
    "packages/vfharness/templates/run-receipt.md",
    "packages/vfharness/playbooks/oma-patterns.md",
    "packages/vfe2b/crews/run.md"
  ],
  "unresolved": [],
  "outcome": "worker_done",
  "pulse": "idle",
  "verification": "python3 scripts/check-all.py — 16/16 PASS",
  "gate": null,
  "escalation": null,
  "last_updated": "2026-08-31"
}
