{
  "task_id": "daily-research-2026-09-02",
  "status": "done",
  "pack": "vfresearch",
  "goal": "Daily office research pass 2026-09-02 — useful SKU-ops embed on existing packs, Hebrew brief line",
  "crew": "research",
  "planned_steps": [
    "Orient vfmem + MAP + DAILY/ORCHESTRA",
    "Open ChatGPT/Gemini/Perplexity or failover",
    "Embed useful bits on vfsku/vfops",
    "Write research.md + orchestra artifact + sensors"
  ],
  "completed_steps": [
    "Office graph + existing SKU/brief packs read",
    "Orchestra desks walled; WebSearch/WebFetch used",
    "SHELF.json + FIRST-PRINT.md + vfsku.py + check-vfsku.py",
    "Hebrew brief line written to vfops/data/research.md"
  ],
  "next_step": "Owner names one licensed model URL for shelf slot 1 (FIRST-PRINT.md)",
  "artifacts": [
    "packages/vfsku/SHELF.json",
    "packages/vfsku/FIRST-PRINT.md",
    "scripts/vfsku.py",
    "scripts/check-vfsku.py",
    "packages/vfresearch/sources/2026-09-02-orchestra.md",
    "packages/vfops/data/research.md",
    "packages/vfops/BRIEF-2026-09-02.md"
  ],
  "unresolved": [
    "ChatGPT/Gemini/Perplexity live chats walled on this Cloud Agent — no invented bodies",
    "Shelf still 0/5 — waiting for owner-named file + floor slice"
  ],
  "outcome": "worker_done",
  "pulse": "working",
  "verification": "scripts/check-all.py passed=19 including check-vfsku.py; vfsku.py brief=0/5; negative test rejected invented name without sourceUrl",
  "gate": null,
  "escalation": null,
  "last_updated": "2026-09-02"
}
