{
  "task_id": "cp083-odirectory-portable-2026-10-18",
  "status": "done",
  "component_state": "Idle",
  "pack": "vfharness",
  "goal": "Fail closed on a missing O_DIRECTORY without weakening POSIX inode refusals.",
  "completed_steps": [
    "CLAIM on #612 comment 6253160713",
    "directory_open_flags refuses SKIP_NON_POSIX when the flag is missing, zero, or the host is not POSIX",
    "POSIX still opens with O_DIRECTORY and still refuses hardlink, symlink, and non-regular evidence",
    "A dropped st_nlink check would accept the alias; the real gate still raises HARDLINK_ALIAS_REFUSED"
  ],
  "next_step": "Independent QA. security_admission stays RED.",
  "artifacts": [
    "scripts/vf_office_v2_604_cp083_candidate_evidence_gate.py",
    "scripts/test_vf_office_v2_604_cp083_candidate_evidence_gate.py"
  ],
  "unresolved": [
    "security_admission stays RED"
  ],
  "last_updated": "2026-10-18",
  "execution_state": {
    "claim": "https://github.com/nocturney/velvetos-core/issues/612#issuecomment-6253160713",
    "security_admission": "RED",
    "tests": 27
  },
  "latest_observation": "On POSIX, directory_open_flags includes O_DIRECTORY. Patching that flag to 0 raises SKIP_NON_POSIX. Dropping the nlink check lets verify succeed; the real function still raises HARDLINK_ALIAS_REFUSED. Symlink and FIFO reads stay refused."
}
